page,element,current_price,correct_price,status,source_evidence,notes
/,Season pass card amount + period,"$149/season","$149/season pass",incorrect,"live https://betwaggle.com/ lines 2487-2488",Amount correct; wording non-canonical
/tour/,Comparison table price row,"$149/season and $32/event","$149/season pass and $32/event",incorrect,"live https://betwaggle.com/tour/ line 295",Known $199 mismatch not present in this run
/pricing/,Season CTA + season plan card + fallback JS,"$149/season","$149/season pass",incorrect,"live https://betwaggle.com/pricing/ lines 794,802-803,971-972",Most visible copy drift remains on canonical pricing page
/demo/,Primary CTA,"$32/event","$32/event",correct,"live https://betwaggle.com/demo/ line 448",No season pricing text shown on demo CTA
/create/,Checkout endpoints in public flow,"/api/create-checkout only","/api/create-checkout only",correct,"live https://betwaggle.com/create/ lines 286,917,1771",No direct /api/create-event reference in public create page
event CTA copy,Core CTA text across / /tour/ /pricing/ /demo,"Set Up Your Event — $32/event","Set Up Your Event — $32/event",correct,"live checks on core conversion pages",Event-tier CTA copy consistent
email templates,Drip + outreach pricing copy,"$32/event and/or $149/season pass","$32/event and/or $149/season pass",correct,"repo scan emails/**/*.html + emails/**/*.md",No season-pass wording drift found in email templates
JSON/JS hardcoded amounts,Checkout constants,"3200 event / 14900 season cents","$32/event / $149/season pass",correct,"worker.js checkout constants",Numeric prices are aligned
worker copy labels,Display labels + prompt strings,"$149/season","$149/season pass",incorrect,"worker.js pricing label/prompt strings",Backend copy still uses non-canonical season wording
